B1: C | C1: C# | D1: D | E1: D# | F1: E | G1: F | H1: F# | I1: G | J1: G# | K1: A | L1: A# | M1: B | N1: 平均律A=432Hz31.8 cent lower than ISO
A2: 1 | B2: =B3/2 -> 32.108592105073498 | C2: =C3/2 -> 34.017868347161603 | D2: =D3/2 -> 36.040676062590897 | E2: =E3/2 -> 38.183766184073598 | F2: =F3/2 -> 40.454291075670398 | G2: =G3/2 -> 42.8598284031414 | H2: =H3/2 -> 45.408406423700598 | I2: =I3/2 -> 48.108530779578302 | J2: =J3/2 -> 50.969212884811398 | K2: =K3/2 -> 54. | L2: =L3/2 -> 57.211007095401897 | M2: =M3/2 -> 60.6129506087061
A3: 2 | B3: =B4/2 -> 64.217184210146897 | C3: =C4/2 -> 68.035736694323205 | D3: =D4/2 -> 72.081352125181894 | E3: =E4/2 -> 76.367532368147096 | F3: =F4/2 -> 80.908582151340795 | G3: =G4/2 -> 85.719656806282799 | H3: =H4/2 -> 90.816812847401195 | I3: =I4/2 -> 96.217061559156605 | J3: =J4/2 -> 101.938425769623 | K3: =K4/2 -> 108. | L3: =L4/2 -> 114.42201419080401 | M3: =M4/2 -> 121.225901217412
A4: 3 | B4: =B5/2 -> 128.43436842029399 | C4: =C5/2 -> 136.07147338864601 | D4: =D5/2 -> 144.16270425036399 | E4: =E5/2 -> 152.73506473629399 | F4: =F5/2 -> 161.81716430268199 | G4: =G5/2 -> 171.439313612566 | H4: =H5/2 -> 181.63362569480199 | I4: =I5/2 -> 192.43412311831301 | J4: =J5/2 -> 203.87685153924599 | K4: =K5/2 -> 216. | L4: =L5/2 -> 228.84402838160801 | M4: =M5/2 -> 242.451802434825
A5: 4 | B5: =K5/POWER(2,9/12) -> 256.86873684058799 | C5: =K5/POWER(2,8/12) -> 272.14294677729299 | D5: =K5/POWER(2,7/12) -> 288.32540850072701 | E5: =K5/POWER(2,6/12) -> 305.47012947258798 | F5: =K5/POWER(2,5/12) -> 323.63432860536301 | G5: =K5/POWER(2,4/12) -> 342.87862722513103 | H5: =K5/POWER(2,3/12) -> 363.26725138960501 | I5: =K5/POWER(2,2/12) -> 384.86824623662699 | J5: =K5/POWER(2,1/12) -> 407.75370307849198 | K5: 432. | L5: =K5*POWER(2,1/12) -> 457.68805676321603 | M5: =K5*POWER(2,2/12) -> 484.90360486964897
A6: 5 | B6: =B5*2 -> 513.73747368117597 | C6: =C5*2 -> 544.28589355458496 | D6: =D5*2 -> 576.65081700145504 | E6: =E5*2 -> 610.94025894517699 | F6: =F5*2 -> 647.26865721072602 | G6: =G5*2 -> 685.75725445026205 | H6: =H5*2 -> 726.53450277920899 | I6: =I5*2 -> 769.73649247325295 | J6: =J5*2 -> 815.50740615698305 | K6: =K5*2 -> 864. | L6: =L5*2 -> 915.37611352643103 | M6: =M5*2 -> 969.80720973929795
A7: 6 | B7: =B6*2 -> 1027.4749473623499 | C7: =C6*2 -> 1088.5717871091699 | D7: =D6*2 -> 1153.3016340029101 | E7: =E6*2 -> 1221.8805178903499 | F7: =F6*2 -> 1294.53731442145 | G7: =G6*2 -> 1371.51450890052 | H7: =H6*2 -> 1453.06900555842 | I7: =I6*2 -> 1539.47298494651 | J7: =J6*2 -> 1631.01481231397 | K7: =K6*2 -> 1728. | L7: =L6*2 -> 1830.75222705286 | M7: =M6*2 -> 1939.6144194786
A8: 7 | B8: =B7*2 -> 2054.9498947246998 | C8: =C7*2 -> 2177.1435742183398 | D8: =D7*2 -> 2306.6032680058202 | E8: =E7*2 -> 2443.7610357807098 | F8: =F7*2 -> 2589.07462884291 | G8: =G7*2 -> 2743.02901780105 | H8: =H7*2 -> 2906.1380111168401 | I8: =I7*2 -> 3078.94596989301 | J8: =J7*2 -> 3262.0296246279299 | K8: =K7*2 -> 3456. | L8: =L7*2 -> 3661.50445410572 | M8: =M7*2 -> 3879.22883895719
A9: 8 | B9: =B8*2 -> 4109.8997894493996 | C9: =C8*2 -> 4354.2871484366797 | D9: =D8*2 -> 4613.2065360116403 | E9: =E8*2 -> 4887.5220715614196 | F9: =F8*2 -> 5178.14925768581 | G9: =G8*2 -> 5486.0580356021001 | H9: =H8*2 -> 5812.2760222336701 | I9: =I8*2 -> 6157.89193978603 | J9: =J8*2 -> 6524.0592492558699 | K9: =K8*2 -> 6912. | L9: =L8*2 -> 7323.00890821145 | M9: =M8*2 -> 7758.4576779143899
A10: 9 | B10: =B9*2 -> 8219.7995788988101
B12: C | C12: C# | D12: D | E12: D# | F12: E | G12: F | H12: F# | I12: G | J12: G# | K12: A | L12: A# | M12: B | N12: 平均律A=440Hz
A13: 1 | B13: =B14/2 -> 32.703195662574799 | C13: =C14/2 -> 34.647828872109002 | D13: =D14/2 -> 36.708095989675897 | E13: =E14/2 -> 38.890872965260101 | F13: =F14/2 -> 41.203444614108697 | G13: =G14/2 -> 43.6535289291255 | H13: =H14/2 -> 46.2493028389543 | I13: =I14/2 -> 48.999429497718701 | J13: =J14/2 -> 51.913087197493098 | K13: =K14/2 -> 55. | L13: =L14/2 -> 58.270470189761198 | M13: =M14/2 -> 61.735412657015502
A14: 2 | B14: =B15/2 -> 65.406391325149698 | C14: =C15/2 -> 69.295657744218005 | D14: =D15/2 -> 73.416191979351893 | E14: =E15/2 -> 77.781745930520202 | F14: =F15/2 -> 82.406889228217494 | G14: =G15/2 -> 87.307057858251 | H14: =H15/2 -> 92.4986056779086 | I14: =I15/2 -> 97.998858995437303 | J14: =J15/2 -> 103.826174394986 | K14: =K15/2 -> 110. | L14: =L15/2 -> 116.540940379522 | M14: =M15/2 -> 123.470825314031
A15: 3 | B15: =B16/2 -> 130.812782650299 | C15: =C16/2 -> 138.59131548843601 | D15: =D16/2 -> 146.83238395870401 | E15: =E16/2 -> 155.56349186104001 | F15: =F16/2 -> 164.81377845643499 | G15: =G16/2 -> 174.614115716502 | H15: =H16/2 -> 184.997211355817 | I15: =I16/2 -> 195.997717990875 | J15: =J16/2 -> 207.65234878997299 | K15: =K16/2 -> 220. | L15: =L16/2 -> 233.08188075904499 | M15: =M16/2 -> 246.94165062806201
A16: 4 | B16: =K16/POWER(2,9/12) -> 261.62556530059902 | C16: =K16/POWER(2,8/12) -> 277.18263097687202 | D16: =K16/POWER(2,7/12) -> 293.66476791740803 | E16: =K16/POWER(2,6/12) -> 311.12698372208098 | F16: =K16/POWER(2,5/12) -> 329.62755691286998 | G16: =K16/POWER(2,4/12) -> 349.228231433004 | H16: =K16/POWER(2,3/12) -> 369.994422711634 | I16: =K16/POWER(2,2/12) -> 391.99543598174898 | J16: =K16/POWER(2,1/12) -> 415.30469757994501 | K16: 440. | L16: =K16*POWER(2,1/12) -> 466.16376151808998 | M16: =K16*POWER(2,2/12) -> 493.88330125612401
A17: 5 | B17: =B16*2 -> 523.25113060119702 | C17: =C16*2 -> 554.36526195374404 | D17: =D16*2 -> 587.32953583481503 | E17: =E16*2 -> 622.25396744416196 | F17: =F16*2 -> 659.25511382573995 | G17: =G16*2 -> 698.456462866008 | H17: =H16*2 -> 739.98884542326903 | I17: =I16*2 -> 783.99087196349899 | J17: =J16*2 -> 830.60939515989003 | K17: =K16*2 -> 880. | L17: =L16*2 -> 932.32752303617997 | M17: =M16*2 -> 987.76660251224803
A18: 6 | B18: =B17*2 -> 1046.5022612023899 | C18: =C17*2 -> 1108.7305239074899 | D18: =D17*2 -> 1174.6590716696301 | E18: =E17*2 -> 1244.5079348883201 | F18: =F17*2 -> 1318.5102276514799 | G18: =G17*2 -> 1396.9129257320201 | H18: =H17*2 -> 1479.9776908465401 | I18: =I17*2 -> 1567.981743927 | J18: =J17*2 -> 1661.2187903197801 | K18: =K17*2 -> 1760. | L18: =L17*2 -> 1864.6550460723599 | M18: =M17*2 -> 1975.5332050244999
A19: 7 | B19: =B18*2 -> 2093.0045224047899 | C19: =C18*2 -> 2217.4610478149798 | D19: =D18*2 -> 2349.3181433392601 | E19: =E18*2 -> 2489.0158697766501 | F19: =F18*2 -> 2637.0204553029598 | G19: =G18*2 -> 2793.8258514640302 | H19: =H18*2 -> 2959.9553816930802 | I19: =I18*2 -> 3135.96348785399 | J19: =J18*2 -> 3322.4375806395601 | K19: =K18*2 -> 3520. | L19: =L18*2 -> 3729.3100921447199 | M19: =M18*2 -> 3951.0664100489898
A20: 8 | B20: =B19*2 -> 4186.0090448095798 | C20: =C19*2 -> 4434.9220956299496 | D20: =D19*2 -> 4698.6362866785203 | E20: =E19*2 -> 4978.0317395532902 | F20: =F19*2 -> 5274.0409106059196 | G20: =G19*2 -> 5587.6517029280603 | H20: =H19*2 -> 5919.9107633861504 | I20: =I19*2 -> 6271.9269757079901 | J20: =J19*2 -> 6644.8751612791202 | K20: =K19*2 -> 7040. | L20: =L19*2 -> 7458.6201842894397 | M20: =M19*2 -> 7902.1328200979897
A21: 9 | B21: =B20*2 -> 8372.0180896191596
B23: C 夾鐘 | C23: C# 姑冼 | D23: D 仲呂 | E23: D# 蕤宾 | F23: E 林鐘 | G23: F 夷則 | H23: F# 南呂 | I23: G 無射 | J23: G# 應鐘 | K23: A 黃鐘 | L23: A# 大呂 | M23: B 太簇 | N23: 十二律 羽调黃鐘=432Hz
A24: 1 | B24: =B25/2 -> 32.4365844726563 | C24: =C25/2 -> 34.171875 | D24: =D25/2 -> 36.491157531738303 | E24: =E25/2 -> 38.443359375 | F24: =F25/2 -> 40.5 | G24: =G25/2 -> 43.248779296875 | H24: =H25/2 -> 45.5625 | I24: =I25/2 -> 48.654876708984403 | J24: =J25/2 -> 51.2578125 | K24: =K25/2 -> 54. | L24: =L25/2 -> 57.6650390625 | M24: =M25/2 -> 60.75
A25: 2 | B25: =B26/2 -> 64.8731689453125 | C25: =C26/2 -> 68.34375 | D25: =D26/2 -> 72.982315063476605 | E25: =E26/2 -> 76.88671875 | F25: =F26/2 -> 81. | G25: =G26/2 -> 86.49755859375 | H25: =H26/2 -> 91.125 | I25: =I26/2 -> 97.309753417968693 | J25: =J26/2 -> 102.515625 | K25: =K26/2 -> 108. | L25: =L26/2 -> 115.330078125 | M25: =M26/2 -> 121.5
A26: 3 | B26: =B27/2 -> 129.746337890625 | C26: =C27/2 -> 136.6875 | D26: =D27/2 -> 145.96463012695301 | E26: =E27/2 -> 153.7734375 | F26: =F27/2 -> 162. | G26: =G27/2 -> 172.9951171875 | H26: =H27/2 -> 182.25 | I26: =I27/2 -> 194.61950683593699 | J26: =J27/2 -> 205.03125 | K26: =K27/2 -> 216. | L26: =L27/2 -> 230.66015625 | M26: =M27/2 -> 243.
A27: 4 | B27: =G27*3/4 -> 259.49267578125 | C27: =H27*3/4 -> 273.375 | D27: =I27*3/4 -> 291.92926025390602 | E27: =J27*3/4 -> 307.546875 | F27: =K27*3/4 -> 324. | G27: =L27*3/4 -> 345.990234375 | H27: =M27*3/4 -> 364.5 | I27: =B27*3/2 -> 389.239013671875 | J27: =C27*3/2 -> 410.0625 | K27: 432. | L27: =E27*3/2 -> 461.3203125 | M27: =F27*3/2 -> 486.
A28: 5 | B28: =B27*2 -> 518.9853515625 | C28: =C27*2 -> 546.75 | D28: =D27*2 -> 583.85852050781295 | E28: =E27*2 -> 615.09375 | F28: =F27*2 -> 648. | G28: =G27*2 -> 691.98046875 | H28: =H27*2 -> 729. | I28: =I27*2 -> 778.47802734375 | J28: =J27*2 -> 820.125 | K28: =K27*2 -> 864. | L28: =L27*2 -> 922.640625 | M28: =M27*2 -> 972.
A29: 6 | B29: =B28*2 -> 1037.970703125 | C29: =C28*2 -> 1093.5 | D29: =D28*2 -> 1167.71704101562 | E29: =E28*2 -> 1230.1875 | F29: =F28*2 -> 1296. | G29: =G28*2 -> 1383.9609375 | H29: =H28*2 -> 1458. | I29: =I28*2 -> 1556.9560546875 | J29: =J28*2 -> 1640.25 | K29: =K28*2 -> 1728. | L29: =L28*2 -> 1845.28125 | M29: =M28*2 -> 1944.
A30: 7 | B30: =B29*2 -> 2075.94140625 | C30: =C29*2 -> 2187. | D30: =D29*2 -> 2335.43408203125 | E30: =E29*2 -> 2460.375 | F30: =F29*2 -> 2592. | G30: =G29*2 -> 2767.921875 | H30: =H29*2 -> 2916. | I30: =I29*2 -> 3113.912109375 | J30: =J29*2 -> 3280.5 | K30: =K29*2 -> 3456. | L30: =L29*2 -> 3690.5625 | M30: =M29*2 -> 3888.
A31: 8 | B31: =B30*2 -> 4151.8828125 | C31: =C30*2 -> 4374. | D31: =D30*2 -> 4670.8681640625 | E31: =E30*2 -> 4920.75 | F31: =F30*2 -> 5184. | G31: =G30*2 -> 5535.84375 | H31: =H30*2 -> 5832. | I31: =I30*2 -> 6227.82421875 | J31: =J30*2 -> 6561. | K31: =K30*2 -> 6912. | L31: =L30*2 -> 7381.125 | M31: =M30*2 -> 7776.
A32: 9 | B32: =B31*2 -> 8303.765625
B34: C 夾鐘 | C34: C# 姑冼 | D34: D 仲呂 | E34: D# 蕤宾 | F34: E 林鐘 | G34: F 夷則 | H34: F# 南呂 | I34: G 無射 | J34: G# 應鐘 | K34: A 黃鐘 | L34: A# 大呂 | M34: B 太簇 | N34: 十二律 羽调黃鐘=440Hz
A35: 1 | B35: =B36/2 -> 33.037261962890597 | C35: =C36/2 -> 34.8046875 | D35: =D36/2 -> 37.166919708252003 | E35: =E36/2 -> 39.1552734375 | F35: =F36/2 -> 41.25 | G35: =G36/2 -> 44.0496826171875 | H35: =H36/2 -> 46.40625 | I35: =I36/2 -> 49.555892944335902 | J35: =J36/2 -> 52.20703125 | K35: =K36/2 -> 55. | L35: =L36/2 -> 58.73291015625 | M35: =M36/2 -> 61.875
A36: 2 | B36: =B37/2 -> 66.074523925781193 | C36: =C37/2 -> 69.609375 | D36: =D37/2 -> 74.333839416503906 | E36: =E37/2 -> 78.310546875 | F36: =F37/2 -> 82.5 | G36: =G37/2 -> 88.099365234375 | H36: =H37/2 -> 92.8125 | I36: =I37/2 -> 99.111785888671903 | J36: =J37/2 -> 104.4140625 | K36: =K37/2 -> 110. | L36: =L37/2 -> 117.4658203125 | M36: =M37/2 -> 123.75
A37: 3 | B37: =B38/2 -> 132.14904785156199 | C37: =C38/2 -> 139.21875 | D37: =D38/2 -> 148.66767883300801 | E37: =E38/2 -> 156.62109375 | F37: =F38/2 -> 165. | G37: =G38/2 -> 176.19873046875 | H37: =H38/2 -> 185.625 | I37: =I38/2 -> 198.22357177734401 | J37: =J38/2 -> 208.828125 | K37: =K38/2 -> 220. | L37: =L38/2 -> 234.931640625 | M37: =M38/2 -> 247.5
A38: 4 | B38: =G38*3/4 -> 264.298095703125 | C38: =H38*3/4 -> 278.4375 | D38: =I38*3/4 -> 297.33535766601602 | E38: =J38*3/4 -> 313.2421875 | F38: =K38*3/4 -> 330. | G38: =L38*3/4 -> 352.3974609375 | H38: =M38*3/4 -> 371.25 | I38: =B38*3/2 -> 396.44714355468801 | J38: =C38*3/2 -> 417.65625 | K38: 440. | L38: =E38*3/2 -> 469.86328125 | M38: =F38*3/2 -> 495.
A39: 5 | B39: =B38*2 -> 528.59619140625 | C39: =C38*2 -> 556.875 | D39: =D38*2 -> 594.67071533203102 | E39: =E38*2 -> 626.484375 | F39: =F38*2 -> 660. | G39: =G38*2 -> 704.794921875 | H39: =H38*2 -> 742.5 | I39: =I38*2 -> 792.894287109375 | J39: =J38*2 -> 835.3125 | K39: =K38*2 -> 880. | L39: =L38*2 -> 939.7265625 | M39: =M38*2 -> 990.
A40: 6 | B40: =B39*2 -> 1057.1923828125 | C40: =C39*2 -> 1113.75 | D40: =D39*2 -> 1189.34143066406 | E40: =E39*2 -> 1252.96875 | F40: =F39*2 -> 1320. | G40: =G39*2 -> 1409.58984375 | H40: =H39*2 -> 1485. | I40: =I39*2 -> 1585.78857421875 | J40: =J39*2 -> 1670.625 | K40: =K39*2 -> 1760. | L40: =L39*2 -> 1879.453125 | M40: =M39*2 -> 1980.
A41: 7 | B41: =B40*2 -> 2114.384765625 | C41: =C40*2 -> 2227.5 | D41: =D40*2 -> 2378.68286132813 | E41: =E40*2 -> 2505.9375 | F41: =F40*2 -> 2640. | G41: =G40*2 -> 2819.1796875 | H41: =H40*2 -> 2970. | I41: =I40*2 -> 3171.5771484375 | J41: =J40*2 -> 3341.25 | K41: =K40*2 -> 3520. | L41: =L40*2 -> 3758.90625 | M41: =M40*2 -> 3960.
A42: 8 | B42: =B41*2 -> 4228.76953125 | C42: =C41*2 -> 4455. | D42: =D41*2 -> 4757.36572265625 | E42: =E41*2 -> 5011.875 | F42: =F41*2 -> 5280. | G42: =G41*2 -> 5638.359375 | H42: =H41*2 -> 5940. | I42: =I41*2 -> 6343.154296875 | J42: =J41*2 -> 6682.5 | K42: =K41*2 -> 7040. | L42: =L41*2 -> 7517.8125 | M42: =M41*2 -> 7920.
A43: 9 | B43: =B42*2 -> 8457.5390625
A44: Ratio | B44: 1968/1630 | C44: 81/64 | D44: 1771/1331 | E44: 729/512 | F44: 3/2 | G44: 6561/4096 | H44: 27/16 | I44: 5905/3277 | J44: 243/128 | K44: 1 | L44: 2187/2048 | M44: 9/8
A45: Cents | B45: =LOG(B38/B16,2)*12*100 -> 17.595007788484299 | C45: =LOG(C38/C16,2)*12*100 -> 7.8200034615503196 | D45: =LOG(D38/D16,2)*12*100 -> 21.505009519259001 | E45: =LOG(E38/E16,2)*12*100 -> 11.730005192324001 | F45: =LOG(F38/F16,2)*12*100 -> 1.9550008653872299 | G45: =LOG(G38/G16,2)*12*100 -> 15.640006923098699 | H45: =LOG(H38/H16,2)*12*100 -> 5.8650025961642198 | I45: =LOG(I38/I16,2)*12*100 -> 19.5500086538757 | J45: =LOG(J38/J16,2)*12*100 -> 9.7750043269375606 | K45: =LOG(K38/K16,2)*12*100 -> 0. | L45: =LOG(L38/L16,2)*12*100 -> 13.685006057711799 | M45: =LOG(M38/M16,2)*12*100 -> 3.9100017307751398
B47: C ga | C47: C# Ga | D47: D ma | E47: D# Ma | F47: E Pa | G47: F dha | H47: F# Dha | I47: G ni | J47: G# Ni | K47: A Sa | L47: A# ri | M47: B Ri | N47: 印度 五度圈Sa=440Hz
A48: 1 | B48: =B49/2 -> 33. | C48: =C49/2 -> 34.8046875 | D48: =D49/2 -> 37.125 | E48: =E49/2 -> 39.1111111111111 | F48: =F49/2 -> 41.25 | G48: =G49/2 -> 44. | H48: =H49/2 -> 46.40625 | I48: =I49/2 -> 49.5 | J48: =J49/2 -> 52.20703125 | K48: =K49/2 -> 55. | L48: =L49/2 -> 58.6666666666667 | M48: =M49/2 -> 61.875
A49: 2 | B49: =B50/2 -> 66. | C49: =C50/2 -> 69.609375 | D49: =D50/2 -> 74.25 | E49: =E50/2 -> 78.2222222222222 | F49: =F50/2 -> 82.5 | G49: =G50/2 -> 88. | H49: =H50/2 -> 92.8125 | I49: =I50/2 -> 99. | J49: =J50/2 -> 104.4140625 | K49: =K50/2 -> 110. | L49: =L50/2 -> 117.333333333333 | M49: =M50/2 -> 123.75
A50: 3 | B50: =B51/2 -> 132. | C50: =C51/2 -> 139.21875 | D50: =D51/2 -> 148.5 | E50: =E51/2 -> 156.444444444444 | F50: =F51/2 -> 165. | G50: =G51/2 -> 176. | H50: =H51/2 -> 185.625 | I50: =I51/2 -> 198. | J50: =J51/2 -> 208.828125 | K50: =K51/2 -> 220. | L50: =L51/2 -> 234.666666666667 | M50: =M51/2 -> 247.5
A51: 4 | B51: =K51*3/5 -> 264. | C51: =H51*3/4 -> 278.4375 | D51: =K51*27/40 -> 297. | E51: =K51*32/45 -> 312.88888888888903 | F51: =K51*3/4 -> 330. | G51: =K51*4/5 -> 352. | H51: =M51*3/4 -> 371.25 | I51: =K51*9/10 -> 396. | J51: =C51*3/2 -> 417.65625 | K51: 440. | L51: =K51*16/15 -> 469.33333333333297 | M51: =F51*3/2 -> 495.
A52: 5 | B52: =B51*2 -> 528. | C52: =C51*2 -> 556.875 | D52: =D51*2 -> 594. | E52: =E51*2 -> 625.77777777777806 | F52: =F51*2 -> 660. | G52: =G51*2 -> 704. | H52: =H51*2 -> 742.5 | I52: =I51*2 -> 792. | J52: =J51*2 -> 835.3125 | K52: =K51*2 -> 880. | L52: =L51*2 -> 938.66666666666697 | M52: =M51*2 -> 990.
A53: 6 | B53: =B52*2 -> 1056. | C53: =C52*2 -> 1113.75 | D53: =D52*2 -> 1188. | E53: =E52*2 -> 1251.55555555556 | F53: =F52*2 -> 1320. | G53: =G52*2 -> 1408. | H53: =H52*2 -> 1485. | I53: =I52*2 -> 1584. | J53: =J52*2 -> 1670.625 | K53: =K52*2 -> 1760. | L53: =L52*2 -> 1877.3333333333301 | M53: =M52*2 -> 1980.
A54: 7 | B54: =B53*2 -> 2112. | C54: =C53*2 -> 2227.5 | D54: =D53*2 -> 2376. | E54: =E53*2 -> 2503.1111111111099 | F54: =F53*2 -> 2640. | G54: =G53*2 -> 2816. | H54: =H53*2 -> 2970. | I54: =I53*2 -> 3168. | J54: =J53*2 -> 3341.25 | K54: =K53*2 -> 3520. | L54: =L53*2 -> 3754.6666666666702 | M54: =M53*2 -> 3960.
A55: 8 | B55: =B54*2 -> 4224. | C55: =C54*2 -> 4455. | D55: =D54*2 -> 4752. | E55: =E54*2 -> 5006.2222222222199 | F55: =F54*2 -> 5280. | G55: =G54*2 -> 5632. | H55: =H54*2 -> 5940. | I55: =I54*2 -> 6336. | J55: =J54*2 -> 6682.5 | K55: =K54*2 -> 7040. | L55: =L54*2 -> 7509.3333333333303 | M55: =M54*2 -> 7920.
A56: 9 | B56: =B55*2 -> 8448.
A57: Ratio | B57: 6/5 | C57: 81/64 | D57: 27/20 | E57: 64/45 | F57: 3/2 | G57: 8/5 | H57: 27/16 | I57: 9/5 | J57: 243/128 | K57: 1 | L57: 16/15 | M57: 9/8
A58: Cents | B58: =LOG(B51/B16,2)*12*100 -> 15.641287000550101 | C58: =LOG(C51/C16,2)*12*100 -> 7.8200034615503196 | D58: =LOG(D51/D16,2)*12*100 -> 19.551288731324799 | E58: =LOG(E51/E16,2)*12*100 -> 9.7762844043900792 | F58: =LOG(F51/F16,2)*12*100 -> 1.9550008653872299 | G58: =LOG(G51/G16,2)*12*100 -> 13.686286135164501 | H58: =LOG(H51/H16,2)*12*100 -> 5.8650025961642198 | I58: =LOG(I51/I16,2)*12*100 -> 17.596287865941399 | J58: =LOG(J51/J16,2)*12*100 -> 9.7750043269375606 | K58: =LOG(K51/K16,2)*12*100 -> 0. | L58: =LOG(L51/L16,2)*12*100 -> 11.7312852697774 | M58: =LOG(M51/M16,2)*12*100 -> 3.9100017307751398
B60: C ga | C60: C# Ga | D60: D ma | E60: D# Ma | F60: E Pa | G60: F dha | H60: F# Dha | I60: G ni | J60: G# Ni | K60: A Sa | L60: A# ri | M60: B Ri | N60: 印度 四度圈Sa=440Hz
A61: 1 | B61: =B62/2 -> 32.592592592592602 | C61: =C62/2 -> 34.375 | D61: =D62/2 -> 36.6666666666667 | E61: =E62/2 -> 38.671875 | F61: =F62/2 -> 40.740740740740698 | G61: =G62/2 -> 43.456790123456798 | H61: =H62/2 -> 45.8333333333333 | I61: =I62/2 -> 48.8888888888889 | J61: =J62/2 -> 51.5625 | K61: =K62/2 -> 55. | L61: =L62/2 -> 57.942386831275698 | M61: =M62/2 -> 61.1111111111111
A62: 2 | B62: =B63/2 -> 65.185185185185205 | C62: =C63/2 -> 68.75 | D62: =D63/2 -> 73.3333333333333 | E62: =E63/2 -> 77.34375 | F62: =F63/2 -> 81.481481481481495 | G62: =G63/2 -> 86.913580246913597 | H62: =H63/2 -> 91.6666666666667 | I62: =I63/2 -> 97.7777777777778 | J62: =J63/2 -> 103.125 | K62: =K63/2 -> 110. | L62: =L63/2 -> 115.884773662551 | M62: =M63/2 -> 122.222222222222
A63: 3 | B63: =B64/2 -> 130.37037037037001 | C63: =C64/2 -> 137.5 | D63: =D64/2 -> 146.666666666667 | E63: =E64/2 -> 154.6875 | F63: =F64/2 -> 162.96296296296299 | G63: =G64/2 -> 173.82716049382699 | H63: =H64/2 -> 183.333333333333 | I63: =I64/2 -> 195.555555555556 | J63: =J64/2 -> 206.25 | K63: =K64/2 -> 220. | L63: =L64/2 -> 231.76954732510299 | M63: =M64/2 -> 244.444444444444
A64: 4 | B64: =K64*16/27 -> 260.74074074074099 | C64: =K64*5/8 -> 275. | D64: =K64*2/3 -> 293.33333333333297 | E64: =K64*45/64 -> 309.375 | F64: =K64*40/54 -> 325.92592592592598 | G64: =K64*64/81 -> 347.65432098765399 | H64: =K64*5/6 -> 366.66666666666703 | I64: =K64*8/9 -> 391.11111111111097 | J64: =K64*15/16 -> 412.5 | K64: 440. | L64: =K64*256/243 -> 463.53909465020598 | M64: =K64*10/9 -> 488.88888888888903
A65: 5 | B65: =B64*2 -> 521.48148148148198 | C65: =C64*2 -> 550. | D65: =D64*2 -> 586.66666666666697 | E65: =E64*2 -> 618.75 | F65: =F64*2 -> 651.85185185185196 | G65: =G64*2 -> 695.308641975309 | H65: =H64*2 -> 733.33333333333303 | I65: =I64*2 -> 782.22222222222194 | J65: =J64*2 -> 825. | K65: =K64*2 -> 880. | L65: =L64*2 -> 927.07818930041196 | M65: =M64*2 -> 977.77777777777806
A66: 6 | B66: =B65*2 -> 1042.9629629629601 | C66: =C65*2 -> 1100. | D66: =D65*2 -> 1173.3333333333301 | E66: =E65*2 -> 1237.5 | F66: =F65*2 -> 1303.7037037037001 | G66: =G65*2 -> 1390.61728395062 | H66: =H65*2 -> 1466.6666666666699 | I66: =I65*2 -> 1564.44444444444 | J66: =J65*2 -> 1650. | K66: =K65*2 -> 1760. | L66: =L65*2 -> 1854.1563786008201 | M66: =M65*2 -> 1955.55555555556
A67: 7 | B67: =B66*2 -> 2085.9259259259302 | C67: =C66*2 -> 2200. | D67: =D66*2 -> 2346.6666666666702 | E67: =E66*2 -> 2475. | F67: =F66*2 -> 2607.4074074074101 | G67: =G66*2 -> 2781.2345679012301 | H67: =H66*2 -> 2933.3333333333298 | I67: =I66*2 -> 3128.8888888888901 | J67: =J66*2 -> 3300. | K67: =K66*2 -> 3520. | L67: =L66*2 -> 3708.3127572016501 | M67: =M66*2 -> 3911.1111111111099
A68: 8 | B68: =B67*2 -> 4171.8518518518504 | C68: =C67*2 -> 4400. | D68: =D67*2 -> 4693.3333333333303 | E68: =E67*2 -> 4950. | F68: =F67*2 -> 5214.8148148148102 | G68: =G67*2 -> 5562.4691358024702 | H68: =H67*2 -> 5866.6666666666697 | I68: =I67*2 -> 6257.7777777777801 | J68: =J67*2 -> 6600. | K68: =K67*2 -> 7040. | L68: =L67*2 -> 7416.6255144032903 | M68: =M67*2 -> 7822.2222222222199
A69: 9 | B69: =B68*2 -> 8343.7037037037007
A70: Ratio | B70: 32/27 | C70: 5/4 | D70: 4/3 | E70: 45/32 | F70: 40/27 | G70: 128/81 | H70: 5/3 | I70: 8/9 | J70: 15/8 | K70: 1 | L70: 256/243 | M70: 10/9
A71: Cents | B71: =LOG(B64/B16,2)*12*100 -> -5.8650025961645902 | C71: =LOG(C64/C16,2)*12*100 -> -13.6862861351647 | D71: =LOG(D64/D16,2)*12*100 -> -1.95500086539028 | E71: =LOG(E64/E16,2)*12*100 -> -9.7762844043906707 | F71: =LOG(F64/F16,2)*12*100 -> -19.551288731327698 | G71: =LOG(G64/G16,2)*12*100 -> -7.8200034615502698 | H71: =LOG(H64/H16,2)*12*100 -> -15.6412870005506 | I71: =LOG(I64/I16,2)*12*100 -> -3.9100017307735202 | J71: =LOG(J64/J16,2)*12*100 -> -11.731285269777199 | K71: =LOG(K64/K16,2)*12*100 -> 0. | L71: =LOG(L64/L16,2)*12*100 -> -9.7750043269373208 | M71: =LOG(M64/M16,2)*12*100 -> -17.596287865939601
B73: C ga | C73: C# Ga | D73: D ma | E73: D# Ma | F73: E Pa | G73: F dha | H73: F# Dha | I73: G ni | J73: G# Ni | K73: A Sa | L73: A# ri | M73: B Ri | N73: 印度 五度圈Sa=432Hz
A74: 1 | B74: =B75/2 -> 32.399999999999999 | C74: =C75/2 -> 34.171875 | D74: =D75/2 -> 36.450000000000003 | E74: =E75/2 -> 38.399999999999999 | F74: =F75/2 -> 40.5 | G74: =G75/2 -> 43.200000000000003 | H74: =H75/2 -> 45.5625 | I74: =I75/2 -> 48.600000000000001 | J74: =J75/2 -> 51.2578125 | K74: =K75/2 -> 54. | L74: =L75/2 -> 57.600000000000001 | M74: =M75/2 -> 60.75
A75: 2 | B75: =B76/2 -> 64.799999999999997 | C75: =C76/2 -> 68.34375 | D75: =D76/2 -> 72.900000000000006 | E75: =E76/2 -> 76.799999999999997 | F75: =F76/2 -> 81. | G75: =G76/2 -> 86.400000000000006 | H75: =H76/2 -> 91.125 | I75: =I76/2 -> 97.200000000000003 | J75: =J76/2 -> 102.515625 | K75: =K76/2 -> 108. | L75: =L76/2 -> 115.2 | M75: =M76/2 -> 121.5
A76: 3 | B76: =B77/2 -> 129.59999999999999 | C76: =C77/2 -> 136.6875 | D76: =D77/2 -> 145.80000000000001 | E76: =E77/2 -> 153.59999999999999 | F76: =F77/2 -> 162. | G76: =G77/2 -> 172.80000000000001 | H76: =H77/2 -> 182.25 | I76: =I77/2 -> 194.40000000000001 | J76: =J77/2 -> 205.03125 | K76: =K77/2 -> 216. | L76: =L77/2 -> 230.40000000000001 | M76: =M77/2 -> 243.
A77: 4 | B77: =K77*3/5 -> 259.19999999999999 | C77: =H77*3/4 -> 273.375 | D77: =K77*27/40 -> 291.60000000000002 | E77: =K77*32/45 -> 307.19999999999999 | F77: =K77*3/4 -> 324. | G77: =K77*4/5 -> 345.60000000000002 | H77: =M77*3/4 -> 364.5 | I77: =K77*9/10 -> 388.80000000000001 | J77: =C77*3/2 -> 410.0625 | K77: 432. | L77: =K77*16/15 -> 460.80000000000001 | M77: =F77*3/2 -> 486.
A78: 5 | B78: =B77*2 -> 518.39999999999998 | C78: =C77*2 -> 546.75 | D78: =D77*2 -> 583.20000000000005 | E78: =E77*2 -> 614.39999999999998 | F78: =F77*2 -> 648. | G78: =G77*2 -> 691.20000000000005 | H78: =H77*2 -> 729. | I78: =I77*2 -> 777.60000000000002 | J78: =J77*2 -> 820.125 | K78: =K77*2 -> 864. | L78: =L77*2 -> 921.60000000000002 | M78: =M77*2 -> 972.
A79: 6 | B79: =B78*2 -> 1036.8 | C79: =C78*2 -> 1093.5 | D79: =D78*2 -> 1166.4000000000001 | E79: =E78*2 -> 1228.8 | F79: =F78*2 -> 1296. | G79: =G78*2 -> 1382.4000000000001 | H79: =H78*2 -> 1458. | I79: =I78*2 -> 1555.2 | J79: =J78*2 -> 1640.25 | K79: =K78*2 -> 1728. | L79: =L78*2 -> 1843.2 | M79: =M78*2 -> 1944.
A80: 7 | B80: =B79*2 -> 2073.5999999999999 | C80: =C79*2 -> 2187. | D80: =D79*2 -> 2332.8000000000002 | E80: =E79*2 -> 2457.5999999999999 | F80: =F79*2 -> 2592. | G80: =G79*2 -> 2764.8000000000002 | H80: =H79*2 -> 2916. | I80: =I79*2 -> 3110.4000000000001 | J80: =J79*2 -> 3280.5 | K80: =K79*2 -> 3456. | L80: =L79*2 -> 3686.4000000000001 | M80: =M79*2 -> 3888.
A81: 8 | B81: =B80*2 -> 4147.1999999999998 | C81: =C80*2 -> 4374. | D81: =D80*2 -> 4665.6000000000004 | E81: =E80*2 -> 4915.1999999999998 | F81: =F80*2 -> 5184. | G81: =G80*2 -> 5529.6000000000004 | H81: =H80*2 -> 5832. | I81: =I80*2 -> 6220.8000000000002 | J81: =J80*2 -> 6561. | K81: =K80*2 -> 6912. | L81: =L80*2 -> 7372.8000000000002 | M81: =M80*2 -> 7776.
A82: 9 | B82: =B81*2 -> 8294.3999999999996
A83: Ratio | B83: 6/5 | C83: 81/64 | D83: 27/20 | E83: 64/45 | F83: 3/2 | G83: 8/5 | H83: 27/16 | I83: 9/5 | J83: 243/128 | K83: 1 | L83: 16/15 | M83: 9/8
A84: Cents | B84: =LOG(B77/B5,2)*12*100 -> 15.6412870005508 | C84: =LOG(C77/C5,2)*12*100 -> 7.8200034615472598 | D84: =LOG(D77/D5,2)*12*100 -> 19.5512887313301 | E84: =LOG(E77/E5,2)*12*100 -> 9.7762844043935093 | F84: =LOG(F77/F5,2)*12*100 -> 1.9550008653883799 | G84: =LOG(G77/G5,2)*12*100 -> 13.6862861351656 | H84: =LOG(H77/H5,2)*12*100 -> 5.8650025961607701 | I84: =LOG(I77/I5,2)*12*100 -> 17.5962878659384 | J84: =LOG(J77/J5,2)*12*100 -> 9.7750043269352602 | K84: =LOG(K77/K5,2)*12*100 -> 0. | L84: =LOG(L77/L5,2)*12*100 -> 11.7312852697758 | M84: =LOG(M77/M5,2)*12*100 -> 3.9100017307755199
B86: C ga | C86: C# Ga | D86: D ma | E86: D# Ma | F86: E Pa | G86: F dha | H86: F# Dha | I86: G ni | J86: G# Ni | K86: A Sa | L86: A# ri | M86: B Ri | N86: 印度 四度圈Sa=432Hz
A87: 1 | B87: =B88/2 -> 32. | C87: =C88/2 -> 33.75 | D87: =D88/2 -> 36. | E87: =E88/2 -> 37.96875 | F87: =F88/2 -> 40. | G87: =G88/2 -> 42.6666666666667 | H87: =H88/2 -> 45. | I87: =I88/2 -> 48. | J87: =J88/2 -> 50.625 | K87: =K88/2 -> 54. | L87: =L88/2 -> 56.8888888888889 | M87: =M88/2 -> 60.
A88: 2 | B88: =B89/2 -> 64. | C88: =C89/2 -> 67.5 | D88: =D89/2 -> 72. | E88: =E89/2 -> 75.9375 | F88: =F89/2 -> 80. | G88: =G89/2 -> 85.3333333333333 | H88: =H89/2 -> 90. | I88: =I89/2 -> 96. | J88: =J89/2 -> 101.25 | K88: =K89/2 -> 108. | L88: =L89/2 -> 113.777777777778 | M88: =M89/2 -> 120.
A89: 3 | B89: =B90/2 -> 128. | C89: =C90/2 -> 135. | D89: =D90/2 -> 144. | E89: =E90/2 -> 151.875 | F89: =F90/2 -> 160. | G89: =G90/2 -> 170.666666666667 | H89: =H90/2 -> 180. | I89: =I90/2 -> 192. | J89: =J90/2 -> 202.5 | K89: =K90/2 -> 216. | L89: =L90/2 -> 227.555555555556 | M89: =M90/2 -> 240.
A90: 4 | B90: =K90*16/27 -> 256. | C90: =K90*5/8 -> 270. | D90: =K90*2/3 -> 288. | E90: =K90*45/64 -> 303.75 | F90: =K90*40/54 -> 320. | G90: =K90*64/81 -> 341.33333333333297 | H90: =K90*5/6 -> 360. | I90: =K90*8/9 -> 384. | J90: =K90*15/16 -> 405. | K90: 432. | L90: =K90*256/243 -> 455.11111111111097 | M90: =K90*10/9 -> 480.
A91: 5 | B91: =B90*2 -> 512. | C91: =C90*2 -> 540. | D91: =D90*2 -> 576. | E91: =E90*2 -> 607.5 | F91: =F90*2 -> 640. | G91: =G90*2 -> 682.66666666666697 | H91: =H90*2 -> 720. | I91: =I90*2 -> 768. | J91: =J90*2 -> 810. | K91: =K90*2 -> 864. | L91: =L90*2 -> 910.22222222222194 | M91: =M90*2 -> 960.
A92: 6 | B92: =B91*2 -> 1024. | C92: =C91*2 -> 1080. | D92: =D91*2 -> 1152. | E92: =E91*2 -> 1215. | F92: =F91*2 -> 1280. | G92: =G91*2 -> 1365.3333333333301 | H92: =H91*2 -> 1440. | I92: =I91*2 -> 1536. | J92: =J91*2 -> 1620. | K92: =K91*2 -> 1728. | L92: =L91*2 -> 1820.44444444444 | M92: =M91*2 -> 1920.
A93: 7 | B93: =B92*2 -> 2048. | C93: =C92*2 -> 2160. | D93: =D92*2 -> 2304. | E93: =E92*2 -> 2430. | F93: =F92*2 -> 2560. | G93: =G92*2 -> 2730.6666666666702 | H93: =H92*2 -> 2880. | I93: =I92*2 -> 3072. | J93: =J92*2 -> 3240. | K93: =K92*2 -> 3456. | L93: =L92*2 -> 3640.8888888888901 | M93: =M92*2 -> 3840.
A94: 8 | B94: =B93*2 -> 4096. | C94: =C93*2 -> 4320. | D94: =D93*2 -> 4608. | E94: =E93*2 -> 4860. | F94: =F93*2 -> 5120. | G94: =G93*2 -> 5461.3333333333303 | H94: =H93*2 -> 5760. | I94: =I93*2 -> 6144. | J94: =J93*2 -> 6480. | K94: =K93*2 -> 6912. | L94: =L93*2 -> 7281.7777777777801 | M94: =M93*2 -> 7680.
A95: 9 | B95: =B94*2 -> 8192.
A96: Ratio | B96: 32/27 | C96: 5/4 | D96: 4/3 | E96: 45/32 | F96: 40/27 | G96: 128/81 | H96: 5/3 | I96: 8/9 | J96: 15/8 | K96: 1 | L96: 256/243 | M96: 10/9
A97: Cents | B97: =LOG(B90/B5,2)*12*100 -> -5.8650025961638201 | C97: =LOG(C90/C5,2)*12*100 -> -13.686286135167601 | D97: =LOG(D90/D5,2)*12*100 -> -1.95500086538489 | E97: =LOG(E90/E5,2)*12*100 -> -9.7762844043871908 | F97: =LOG(F90/F5,2)*12*100 -> -19.551288731326402 | G97: =LOG(G90/G5,2)*12*100 -> -7.8200034615494998 | H97: =LOG(H90/H5,2)*12*100 -> -15.641287000554099 | I97: =LOG(I90/I5,2)*12*100 -> -3.9100017307766 | J97: =LOG(J90/J5,2)*12*100 -> -11.7312852697794 | K97: =LOG(K90/K5,2)*12*100 -> 0. | L97: =LOG(L90/L5,2)*12*100 -> -9.7750043269390599 | M97: =LOG(M90/M5,2)*12*100 -> -17.596287865939399